{
  "name": "Zhang Wei",
  "handedness": "right",
  "elo": 2100,
  "attributes": {
    "footwork": 82,
    "reaction": 78,
    "spinRead": 75,
    "deception": 70,
    "stamina": 72,
    "mental": 68,
    "service": 80,
    "adaptability": 65
  },
  "equipment": {
    "blade": { "speed": 88 },
    "forehandRubber": {
      "type": "inverted",
      "spin": 90,
      "speed": 85,
      "control": 65
    },
    "backhandRubber": {
      "type": "inverted",
      "spin": 82,
      "speed": 80,
      "control": 72
    }
  },
  "preferences": {
    "topspinLoop": 0.45,
    "push": 0.06,
    "block": 0.12,
    "smash": 0.20,
    "chop": 0.02,
    "flick": 0.15
  },
  "shots": {
    "topspinLoop": {
      "power": 88,
      "spinRange": { "min": 55, "max": 92 },
      "accuracy": 78,
      "consistency": 80
    },
    "push": {
      "power": 30,
      "spinRange": { "min": 20, "max": 45 },
      "accuracy": 65,
      "consistency": 70
    },
    "block": {
      "power": 45,
      "spinRange": { "min": 10, "max": 30 },
      "accuracy": 72,
      "consistency": 75
    },
    "smash": {
      "power": 92,
      "spinRange": { "min": 5, "max": 20 },
      "accuracy": 70,
      "consistency": 65
    },
    "chop": {
      "power": 25,
      "spinRange": { "min": 15, "max": 35 },
      "accuracy": 45,
      "consistency": 40
    },
    "flick": {
      "power": 72,
      "spinRange": { "min": 30, "max": 65 },
      "accuracy": 75,
      "consistency": 72
    }
  },
  "serveTendencies": {
    "length": 60,
    "speed": 70,
    "spinAmount": 75,
    "spinVariation": 55,
    "backspinBias": 35,
    "sidespinBias": 65,
    "risk": 60
  },
  "badges": []
}
